{
  "schemaVersion": "1",
  "id": "frontend/vue-vite",
  "displayName": "Vue (Vite)",
  "category": "frontend",
  "language": "TypeScript",
  "framework": "Vite",
  "runtime": "node",
  "installCommand": "npm install",
  "buildCommand": "npm run build",
  "startCommand": "npm run preview -- --host 0.0.0.0 --port ${PORT:-4173}",
  "port": 4173,
  "healthCheck": {
    "type": "http",
    "path": "/",
    "expectedStatus": 200
  },
  "outputs": {
    "staticDir": "dist"
  },
  "env": [
    {
      "name": "VITE_APP_TITLE",
      "required": false,
      "description": "Optional heading text; Vite exposes VITE_* to the client bundle (never put secrets in VITE_* vars)."
    }
  ],
  "tags": ["vue", "vite", "spa"],
  "support": "official"
}
